{
  "$schema": "schemas/forge-capabilities.schema.json",
  "schema_version": "1.1.0",
  "release": {
    "product_version_source": "git-tag-release-workflow",
    "adapters": {
      "claude": { "optional": true, "host": "claude" },
      "codex": { "optional": true, "host": "codex" }
    }
  },
  "reason_codes": ["available", "missing", "unsupported", "inconclusive", "permission-denied", "not-selected", "invalid-output", "exit-nonzero", "minimum-version", "capability-observed", "capability-absent"],
  "runtimes": {
    "node": {
      "required": true,
      "minimum_version": "18.0.0",
      "probe": { "kind": "node" },
      "platforms": { "macos": "common", "windows": "common", "linux": "common" }
    },
    "claude": {
      "required": false,
      "probe": { "kind": "cli", "command": "claude", "version_args": ["--version"], "behavior_args": ["--help"] },
      "platforms": { "macos": "common", "windows": "common", "linux": "common" },
      "capability_probes": [
        { "id": "claude-stream-json", "args": ["--help"], "expect_output": ["--output-format", "--input-format"] }
      ]
    },
    "codex": {
      "required": false,
      "probe": { "kind": "cli", "command": "codex", "version_args": ["--version"], "behavior_args": ["--help"] },
      "platforms": { "macos": "common", "windows": "common", "linux": "common" },
      "capability_probes": [
        { "id": "codex-app-server", "args": ["app-server", "--help"] },
        { "id": "codex-exec-json", "args": ["exec", "--help"], "expect_output": ["--json"] }
      ]
    }
  },
  "capabilities": [
    { "capability_id": "skill-forge-accounts", "kind": "skill", "owner": "accounts", "required": true, "classification": "conditional", "hosts": { "claude": "implemented", "codex": "distributed" }, "probe": { "kind": "filesystem", "path": "skills/forge-accounts/SKILL.md" } },
    { "capability_id": "skill-forge-add-slice", "kind": "skill", "owner": "planning", "required": true, "classification": "conditional", "hosts": { "claude": "implemented", "codex": "distributed" }, "probe": { "kind": "filesystem", "path": "skills/forge-add-slice/SKILL.md" } },
    { "capability_id": "skill-forge-add-task", "kind": "skill", "owner": "planning", "required": true, "classification": "conditional", "hosts": { "claude": "implemented", "codex": "distributed" }, "probe": { "kind": "filesystem", "path": "skills/forge-add-task/SKILL.md" } },
    { "capability_id": "skill-forge-ask", "kind": "skill", "owner": "conversation", "required": true, "classification": "conditional", "hosts": { "claude": "implemented", "codex": "distributed" }, "probe": { "kind": "filesystem", "path": "skills/forge-ask/SKILL.md" } },
    { "capability_id": "skill-forge-auto", "kind": "skill", "owner": "orchestration", "required": true, "classification": "conditional", "hosts": { "claude": "implemented", "codex": "distributed" }, "probe": { "kind": "filesystem", "path": "skills/forge-auto/SKILL.md" } },
    { "capability_id": "skill-forge-brainstorm", "kind": "skill", "owner": "planning", "required": true, "classification": "conditional", "hosts": { "claude": "implemented", "codex": "distributed" }, "probe": { "kind": "filesystem", "path": "skills/forge-brainstorm/SKILL.md" } },
    { "capability_id": "skill-forge-codebase", "kind": "skill", "owner": "quality", "required": true, "classification": "conditional", "hosts": { "claude": "implemented", "codex": "distributed" }, "probe": { "kind": "filesystem", "path": "skills/forge-codebase/SKILL.md" } },
    { "capability_id": "skill-forge-config", "kind": "skill", "owner": "configuration", "required": true, "classification": "conditional", "hosts": { "claude": "implemented", "codex": "distributed" }, "probe": { "kind": "filesystem", "path": "skills/forge-config/SKILL.md" } },
    { "capability_id": "skill-forge-curate", "kind": "skill", "owner": "maintenance", "required": true, "classification": "conditional", "hosts": { "claude": "implemented", "codex": "distributed" }, "probe": { "kind": "filesystem", "path": "skills/forge-curate/SKILL.md" } },
    { "capability_id": "skill-forge-discuss", "kind": "skill", "owner": "planning", "required": true, "classification": "conditional", "hosts": { "claude": "implemented", "codex": "distributed" }, "probe": { "kind": "filesystem", "path": "skills/forge-discuss/SKILL.md" } },
    { "capability_id": "skill-forge-doctor", "kind": "skill", "owner": "quality", "required": true, "classification": "conditional", "hosts": { "claude": "implemented", "codex": "distributed" }, "probe": { "kind": "filesystem", "path": "skills/forge-doctor/SKILL.md" } },
    { "capability_id": "skill-forge-explain", "kind": "skill", "owner": "conversation", "required": true, "classification": "conditional", "hosts": { "claude": "implemented", "codex": "distributed" }, "probe": { "kind": "filesystem", "path": "skills/forge-explain/SKILL.md" } },
    { "capability_id": "skill-forge-help", "kind": "skill", "owner": "conversation", "required": true, "classification": "conditional", "hosts": { "claude": "implemented", "codex": "distributed" }, "probe": { "kind": "filesystem", "path": "skills/forge-help/SKILL.md" } },
    { "capability_id": "skill-forge-mcps", "kind": "skill", "owner": "integrations", "required": true, "classification": "conditional", "hosts": { "claude": "implemented", "codex": "distributed" }, "probe": { "kind": "filesystem", "path": "skills/forge-mcps/SKILL.md" } },
    { "capability_id": "skill-forge-memories", "kind": "skill", "owner": "memory", "required": true, "classification": "conditional", "hosts": { "claude": "implemented", "codex": "distributed" }, "probe": { "kind": "filesystem", "path": "skills/forge-memories/SKILL.md" } },
    { "capability_id": "skill-forge-new-milestone", "kind": "skill", "owner": "planning", "required": true, "classification": "conditional", "hosts": { "claude": "implemented", "codex": "distributed" }, "probe": { "kind": "filesystem", "path": "skills/forge-new-milestone/SKILL.md" } },
    { "capability_id": "skill-forge-next", "kind": "skill", "owner": "orchestration", "required": true, "classification": "conditional", "hosts": { "claude": "implemented", "codex": "distributed" }, "probe": { "kind": "filesystem", "path": "skills/forge-next/SKILL.md" } },
    { "capability_id": "skill-forge-pause", "kind": "skill", "owner": "orchestration", "required": true, "classification": "conditional", "hosts": { "claude": "implemented", "codex": "distributed" }, "probe": { "kind": "filesystem", "path": "skills/forge-pause/SKILL.md" } },
    { "capability_id": "skill-forge-prefs", "kind": "skill", "owner": "configuration", "required": true, "classification": "conditional", "hosts": { "claude": "implemented", "codex": "distributed" }, "probe": { "kind": "filesystem", "path": "skills/forge-prefs/SKILL.md" } },
    { "capability_id": "skill-forge-probe", "kind": "skill", "owner": "quality", "required": true, "classification": "conditional", "hosts": { "claude": "implemented", "codex": "distributed" }, "probe": { "kind": "filesystem", "path": "skills/forge-probe/SKILL.md" } },
    { "capability_id": "skill-forge-responsive", "kind": "skill", "owner": "quality", "required": true, "classification": "conditional", "hosts": { "claude": "implemented", "codex": "distributed" }, "probe": { "kind": "filesystem", "path": "skills/forge-responsive/SKILL.md" } },
    { "capability_id": "skill-forge-risk-radar", "kind": "skill", "owner": "quality", "required": true, "classification": "conditional", "hosts": { "claude": "implemented", "codex": "distributed" }, "probe": { "kind": "filesystem", "path": "skills/forge-risk-radar/SKILL.md" } },
    { "capability_id": "skill-forge-scope-clarity", "kind": "skill", "owner": "planning", "required": true, "classification": "conditional", "hosts": { "claude": "implemented", "codex": "distributed" }, "probe": { "kind": "filesystem", "path": "skills/forge-scope-clarity/SKILL.md" } },
    { "capability_id": "skill-forge-security", "kind": "skill", "owner": "security", "required": true, "classification": "conditional", "hosts": { "claude": "implemented", "codex": "distributed" }, "probe": { "kind": "filesystem", "path": "skills/forge-security/SKILL.md" } },
    { "capability_id": "skill-forge-skills", "kind": "skill", "owner": "conversation", "required": true, "classification": "conditional", "hosts": { "claude": "implemented", "codex": "distributed" }, "probe": { "kind": "filesystem", "path": "skills/forge-skills/SKILL.md" } },
    { "capability_id": "skill-forge-status", "kind": "skill", "owner": "orchestration", "required": true, "classification": "conditional", "hosts": { "claude": "implemented", "codex": "distributed" }, "probe": { "kind": "filesystem", "path": "skills/forge-status/SKILL.md" } },
    { "capability_id": "skill-forge-sweep", "kind": "skill", "owner": "maintenance", "required": true, "classification": "conditional", "hosts": { "claude": "implemented", "codex": "distributed" }, "probe": { "kind": "filesystem", "path": "skills/forge-sweep/SKILL.md" } },
    { "capability_id": "skill-forge-task", "kind": "skill", "owner": "orchestration", "required": true, "classification": "conditional", "hosts": { "claude": "implemented", "codex": "distributed" }, "probe": { "kind": "filesystem", "path": "skills/forge-task/SKILL.md" } },
    { "capability_id": "skill-forge-ui-review", "kind": "skill", "owner": "quality", "required": true, "classification": "conditional", "hosts": { "claude": "implemented", "codex": "distributed" }, "probe": { "kind": "filesystem", "path": "skills/forge-ui-review/SKILL.md" } },
    { "capability_id": "agent-forge-advocate", "kind": "agent", "owner": "review", "required": true, "classification": "conditional", "hosts": { "claude": "implemented", "codex": "distributed" }, "probe": { "kind": "filesystem", "path": "agents/forge-advocate.md" } },